{
  "generated_at": "2026-07-08",
  "reviewed_by": "codex_source_review",
  "policy": {
    "decision_basis": "장소명 포함 관계, 기존 공식 접근성 출처의 장소명·주소·세부 동선 설명, roadview 초안의 동일 시설명 여부를 함께 확인한다.",
    "field_update_policy": "uncertain_match 해소 단계에서는 접근성 필드 값을 변경하지 않고, 중복 방지를 위한 동일·하위 장소 판단과 운영 메모만 반영한다."
  },
  "summary": {
    "uncertain_matches_reviewed": 6,
    "confirmed_same_place": 2,
    "confirmed_same_accessibility_scope": 1,
    "covered_subplace": 3,
    "separate_candidates": 0
  },
  "resolutions": [
    {
      "existing_id": "jeju_sea_songaksan_023",
      "existing_name": "송악산",
      "draft_id": "jeju_roadview_place_021",
      "draft_name": "송악산전망대",
      "decision": "covered_subplace",
      "reason": "송악산전망대는 송악산 관광권 안의 하위 전망 지점으로 판단되며, 별도 장소 카드로 중복 추가하지 않고 송악산 카드의 하위 지점 검수 근거로 남긴다.",
      "evidence_sources": [
        {
          "title": "열린관광 모두의 여행 송악산",
          "url": "https://access.visitkorea.or.kr/ms/detail.do?cotId=1b5929e2-60a3-4de4-8616-9451b2cdabfa"
        },
        {
          "title": "제주특별자치도_사회적약자 시설 데이터(로드뷰) 구축 관광지 현황",
          "url": "https://www.data.go.kr/data/15109153/fileData.do"
        }
      ],
      "safety_note": "송악산전망대 구간은 송악산 전체 카드의 화장실·동선 정보와 다를 수 있으므로 전망대 지점 시설은 방문 전 별도 확인 필요"
    },
    {
      "existing_id": "jeju_indoor_haenyeo_024",
      "existing_name": "제주해녀박물관",
      "draft_id": "jeju_roadview_place_042",
      "draft_name": "해녀박물관",
      "decision": "confirmed_same_place",
      "reason": "해녀박물관은 제주해녀박물관의 축약 명칭으로, 기존 카드와 roadview 초안이 같은 박물관을 가리킨다.",
      "evidence_sources": [
        {
          "title": "이지제주 제주해녀박물관",
          "url": "https://easyjeju.net/pages.php?no=35&p=tourist"
        },
        {
          "title": "제주특별자치도_사회적약자 시설 데이터(로드뷰) 구축 관광지 현황",
          "url": "https://www.data.go.kr/data/15109153/fileData.do"
        }
      ],
      "safety_note": "제주해녀박물관 외부 관람로와 기념탑 방향은 경사·요철 구간이 있어 휠체어 사용자는 실내 중심 동선 권장"
    },
    {
      "existing_id": "jeju_forest_saryeoni_002",
      "existing_name": "사려니숲길 무장애나눔길",
      "draft_id": "jeju_roadview_place_060",
      "draft_name": "사려니숲길",
      "decision": "confirmed_same_accessibility_scope",
      "reason": "roadview 초안은 사려니숲길 전체명으로 들어왔지만, 기존 카드는 접근 가능한 무장애나눔길 범위를 서비스 대상으로 삼고 있어 같은 추천 범위로 관리한다.",
      "evidence_sources": [
        {
          "title": "이지제주 사려니숲길",
          "url": "https://easyjeju.net/pages.php?no=1000&p=tourist"
        },
        {
          "title": "제주특별자치도_사회적약자 시설 데이터(로드뷰) 구축 관광지 현황",
          "url": "https://www.data.go.kr/data/15109153/fileData.do"
        }
      ],
      "safety_note": "사려니숲길 전체가 아니라 무장애나눔길 이용 위치와 진입 경사를 기준으로 추천해야 함"
    },
    {
      "existing_id": "jeju_forest_red_oreum_004",
      "existing_name": "붉은오름자연휴양림",
      "draft_id": "jeju_roadview_place_061",
      "draft_name": "붉은오름자연휴양림(무장애나눔숲길)",
      "decision": "covered_subplace",
      "reason": "무장애나눔숲길은 붉은오름자연휴양림 안의 세부 접근 가능 구간으로 판단되며, 기존 휴양림 카드에 포함해 관리한다.",
      "evidence_sources": [
        {
          "title": "이지제주 붉은오름자연휴양림",
          "url": "https://easyjeju.net/pages.php?no=59&p=tourist"
        },
        {
          "title": "제주특별자치도_사회적약자 시설 데이터(로드뷰) 구축 관광지 현황",
          "url": "https://www.data.go.kr/data/15109153/fileData.do"
        }
      ],
      "safety_note": "붉은오름자연휴양림은 세부 숲길별 주차·화장실 위치가 다를 수 있어 방문 동선 선택 시 구간명을 확인해야 함"
    },
    {
      "existing_id": "jeju_forest_red_oreum_004",
      "existing_name": "붉은오름자연휴양림",
      "draft_id": "jeju_roadview_place_062",
      "draft_name": "붉은오름자연휴양림(삼나무데크)",
      "decision": "covered_subplace",
      "reason": "삼나무데크는 붉은오름자연휴양림 안의 세부 구간으로 판단되며, 별도 장소 카드로 중복 추가하지 않는다.",
      "evidence_sources": [
        {
          "title": "이지제주 붉은오름자연휴양림",
          "url": "https://easyjeju.net/pages.php?no=59&p=tourist"
        },
        {
          "title": "제주특별자치도_사회적약자 시설 데이터(로드뷰) 구축 관광지 현황",
          "url": "https://www.data.go.kr/data/15109153/fileData.do"
        }
      ],
      "safety_note": "붉은오름자연휴양림 삼나무데크 구간은 휴양림 전체 접근성 정보와 분리해 세부 동선 확인 필요"
    },
    {
      "existing_id": "jeju_indoor_starlight_025",
      "existing_name": "별빛누리공원",
      "draft_id": "jeju_roadview_place_086",
      "draft_name": "제주별빛누리공원",
      "decision": "confirmed_same_place",
      "reason": "제주별빛누리공원은 별빛누리공원의 공식 접두어 포함 명칭으로, 기존 카드와 roadview 초안이 같은 시설을 가리킨다.",
      "evidence_sources": [
        {
          "title": "이지제주 별빛누리공원",
          "url": "https://easyjeju.net/pages.php?no=768&p=tourist"
        },
        {
          "title": "제주특별자치도_사회적약자 시설 데이터(로드뷰) 구축 관광지 현황",
          "url": "https://www.data.go.kr/data/15109153/fileData.do"
        }
      ],
      "safety_note": "별빛누리공원은 천체관측실 접근 계단과 야간 운영 시간을 방문 전 확인 필요"
    }
  ]
}
